{
    "summary": [
        {
            "title": "التعلم الآلي المتكامل",
            "body": "خبرة في دورة حياة التعلم الآلي من معالجة البيانات واستخراج الخصائص إلى نشر النماذج عالية الأداء."
        },
        {
            "title": "الذكاء التوليدي وLLM",
            "body": "بناء وتحسين النماذج اللغوية الكبيرة باستخدام هندسة التلقين و RLHF وتقنيات LoRA/QLoRA للغة العربية."
        },
        {
            "title": "الاسترجاع المتقدم والبحث المتجهي",
            "body": "تصميم أنظمة استرجاع تعتمد على البحث الكثيف والهجين باستخدام قواعد بيانات متجهة قابلة للتوسع."
        }
    ],
    "projects": [
        {
            "title": "نظام RAG عربي واعٍ بالسياق الثقافي",
            "image": "https://placehold.co/600x400/D92323/121212?text=Arabic+RAG",
            "description": "تطوير خط معالجة استرجاع-تعزيز توليد مهيأ للهجات العربية باستخدام تضمينات مخصصة وبحث هجين.",
            "tech": ["PyTorch", "Weaviate", "LLM Fine-Tuning"]
        },
        {
            "title": "وكيل ذكاء اصطناعي للتحليل البياني",
            "image": "https://placehold.co/600x400/333333/FFFFFF?text=AI+Agent",
            "description": "بناء وكيل ذاتي قادر على تحليل البيانات من التنظيف إلى توليد التقارير المرئية.",
            "tech": ["LangChain", "Pandas", "OpenAI API"]
        }
    ],
    "skills": [
        "Python",
        "PyTorch",
        "TensorFlow",
        "Scikit-learn",
        "Pandas",
        "Docker",
        "SQL",
        "Apache Spark",
        "MLflow"
    ],
    "publications": [
        {
            "title": "مراجعة شاملة للذكاء الاصطناعي 2024",
            "image": "../docs/report.png",
            "published": "يناير 2025",
            "description": "تقرير سنوي يعرض أهم الاختراقات والاتجاهات البارزة في الذكاء الاصطناعي خلال عام 2024.",
            "link": "#"
        },
        {
            "title": "اختيار التخصص التقني المناسب",
            "image": "../docs/guide.png",
            "published": "يوليو 2025",
            "description": "دليل عملي للطلاب لاتخاذ قرارات مدروسة حول تخصصات تقنية المعلومات ومساراتها المهنية.",
            "link": "#"
        }
    ]
}
